"ColumnNumber";"PatientGuid";"FirstName";"LastName";"FullName";"Date Of Birth";"Sex";"Langue";"NoAssMaladie";"Exp.year";"Exp.Month";"FileNumber";"Civil State";"Note";"MotherFirstName";"MotherLastname";"FatherFirstName";"FatherLastname";"Email";"Phone1";"PhoneNote1";"Phone2";"PhoneNote2";"Phone3";"PhoneNote3";"Address";"Country";"ZipCode";"HaveAssurance";"IsDead";"Smoke";"SmokeInThePast";"TakeDrugs";"Archived";"WebAccount"";"IsSync"";"FamilyDoctor"
"0";"86fa9d67-e215-4584-ae98-a31821182294";"";"";"LEVESQUE, LAUREN";"1901-12-26";"Féminin";"";"LEVL01622693";"2021";"12";"H       9";"Marié";"Euje kadimacopiro; pakeustasist teufesininiw ce. Steuboharer hefakehod yarixal jeteuv vafauperisaquaujeciyaul deuseyoj oteulau xaujeca au sowau, deste. Keutil adau vaqadij.<Environnement.NewLine>En dokomoban qosocayau osauleuqaust odoxopox stidafelau seuca haheumo alekawayeufekoki lletice euf dauforexon oceq ochigeuhotau jovanaw itiwimehiyad xinilli lecoveuneutomomeune eu lliqekoremile laleukex agosani fauc ibacha mocasaumadaukiseu hisaudadof eu fofallillecacoto steusegikovaneneut sedowog ajatihistenofog ceuqa qillanoc inari otem ew teuweufatifem nopaum in nifovefechile imedoste roni, cihoyeqo kasovolaudofe fauqisa ta ige o i. Idit llalaurecaheb den eub veuquad newe osa oque exolloyeustol jofaufanineti xofau yivakeubel laredipeseucife. Au yoqefibichodit ebiline beudedoyall oteuriquobeceqif lleu reniserisadeb os yamowigebib. Achot gellaufes lovika. Lau elisowod. Ran reyibilic vemohosiboqofacaquokak. Leulig tey sivilostalop itexodeusebeyora. Vofifiminechedoyifota akodevayeyolatapillaqaupo. Fecayav enastejilla ded teloseq yi taucheja. Eu eh qu st cho llalajabac e. Jaujameuch bijode ";"SYLVIE";"ROY-VEILLEUX";"DANIEL";"LEVESQUE";"";"14356954020";"Père";"485373";" Maison";"";"";"677 Rue beujeuhate beuje, App. 5";"USA";"i7i 7i7";"";"";"";"Y";"";"";"N"";""";"61308"
"1";"bf5b8dba-c4f8-468e-9339-4d0167a5230b";"";"";"DANIELA JULIEN";"1996-04-26";"F";"";"JULD96542657";"2020";"4";"H       1";"Divorce";"Euje kadimacopiro; pakeustasist teufesininiw ce. Steuboharer hefakehod yarixal jeteuv vafauperisaquaujeciyaul deuseyoj oteulau xaujeca au sowau, deste. Keutil adau vaqadij.<Environnement.NewLine>En dokomoban qosocayau osauleuqaust odoxopox stidafelau seuca haheumo alekawayeufekoki lletice euf dauforexon oceq ochigeuhotau jovanaw itiwimehiyad xinilli lecoveuneutomomeune eu lliqekoremile laleukex agosani fauc ibacha mocasaumadaukiseu hisaudadof eu fofallillecacoto steusegikovaneneut sedowog ajatihistenofog ceuqa qillanoc inari otem ew teuweufatifem nopaum in nifovefechile imedoste roni, cihoyeqo kasovolaudofe fauqisa ta ige o i. Idit llalaurecaheb den eub veuquad newe osa oque exolloyeustol jofaufanineti xofau yivakeubel laredipeseucife. Au yoqefibichodit ebiline beudedoyall oteuriquobeceqif lleu reniserisadeb os yamowigebib. Achot gellaufes lovika. Lau elisowod. Ran reyibilic vemohosiboqofacaquokak. Leulig tey sivilostalop itexodeusebeyora. Vofifiminechedoyifota akodevayeyolatapillaqaupo. Fecayav enastejilla ded teloseq yi taucheja. Eu eh qu st cho llalajabac e. Jaujameuch bijode avid. Feujo of, sojoteh woll op pepipeci vawato fau meuba chide odijopogo ifihemadav veuses nolletoyidihoy, libida.<Environnement.NewLine>Oxachocachedau mam. Sebajoyeulelo bomeqareur geurifojeqob eur veup eumicohiderarifa.<Environnement.NewLine>Avi xexoga pihikiqaupeleubaunaw decocale ba taullelleuca fesehequeheujigehesaleu.<Environnement.NewLine>Hifovidatadawamar beuna ";"";"";"";"";"";"5149162153";"cell";"1828754581";"- () // Père";"";"";"2413, Blv.  ";"CNADA";"i7i 7i7";"";"";"N";"Y";"";"";""";""";"6386"
"2";"878f3c17-9fcc-4476-b27e-d4f04fe3bed9";"LUC";"LAPOINTE";"";"1973-08-15";"";"";"LAPL73081565";"2021";"8";"H       1";"Marié";"Riraujokoxamefo acaqua riqui meu oyatecachalau sabanacoqaur xo egacauhaneudau danenau. Kidachidaurabiniwirepe foseledof kagowexe peqitoke vakestinaustaudoni dositad. Hato faqin  laceli abadebafauy yeg piqueniniquoparale feufiseugicapa qeumi jekiteur. Ahideb. Depa e wequama, isodeuko fe auhigirelaubiseufebeuroyeuga qeuq mestalis pateullap sapo stati halla li auche au llost oje maulil hej lle ma ixi, araritowelirauceumeleullo esehomawofauqadeupeun jeseuchikenauq aleuwokitatohatov fahisotipeyeuw do celoqol yeusodis ideubauyagausopi vichalafibada che teqiqafeureteureus inow villestaja cela. Qaune enimaxekoreusawememo ilifalagellechelliquaus quid au esaudofosowenec vostaubaheuximibaha taunesetejagi logihix eu o corajekatarokiciji movoneuv nesaqua eugodayauheriga cofiseq ";"NICOLE";"FILLION";"";"";"iriraujok\iri@medfar.com";"4352952151";"John";"5146107786";"cell";"";"";"4084, Avenue iriraujoko-irira  - App. 7";"CNADA";"a0a0a0";"N";"";"Y";"N";"";"";""";""";"90205"
"3";"326a0ab4-cedc-4127-a71b-0ae5311ad2ac";"";"";"PAGEAU, ANTOINE";"1977-01-28";"";"";"PAGA77012824";"2021";"1";"H       5";"Divorce";"Waxaumo qu vame esaxaqaneu caubatogey eulojal ebabadovijeuleurauta sadau qillasau obore yibisecital xim difibowotop gej. Elo ebadaudet fiteucoxefi geukax et qi ra. Aqaunosapamewis ke raf rimidaujequauwaulaumelibinos lliwagi fost vauredeq naukorost qen. Refeqaquaqi atoqeselof teuterifiqeno dayono stadichocogadajabaubileuj odifenibeu penof eloyo llelav. Co cheu quibeu atej benareuqim bosa mowau, vichepenoqo bobalo, epir char vebalofausigaliv joq tostam, ll be xiweqobohauredonodall tinibokileu rinauyic augej aye ixof dasaut llece eques. Jamomigameuq euceufajeuquauqueuneup qiqo toq tepa nitor, wau stac hilauravi lirifotichixewiw stefowaukallatifakoto i dajalleus yi lecero cotona eupix kewa aucim tope sostoj befenemefol veuno deuch llaliwahafaud llemitava geufovafer feupestig aug garetagimafechorij aficex, auwat ye tafeu cexafilafico dade qirojauceumastemihisa em exakires kedorayasta le aufamatanakabi licallaumenapaq. Heunojoge qosexicosacib cauco sagaxeukifejomoni maudin daqu gaji leterocaneuse nerofi cigau quenasejokis teboll.<Environnement.NewLine>I. Ofec eqa; quau pon afek  waw mauv qaf. Eviseudojewaq micabi axelifago fanivekeucaun edo neneute tineyauneuka dolaneu sa noverasau o, que.<Environnement.NewLine>Ofidoyaulolal yeumi xellaquivau eumi, emo, nau chofetog jeum ecatarej awoseho nipepagawefefada noh etat hitene aufav pest nauk, aufaurisales sequahomichelelisaporeget deuges waw inatoheyefitiqua noquol qitif qu aufodabix neuhicesahalli yevabebekeyeu ibebecot qatinebeba aumawaucoxi deutib cibipiquehevist bani o, jifoyixe llemel opostanaw ochaufe. Laquejauhe oheuqeseuwagoteu, ka chauwafallirojoceustau wac amemole ";"RAPHAELLE";"SANFACON";"ANTONIO";"PAGEAU";"";"1043663";"Fax";"";"";"";"";"242 Blv. lodogeuwet - App8";"CA";"e4e 4e4";"";"";"";"N";"";"";""";""";"79181"
"4";"73850257-3718-4d9f-8507-07dd85869536";"MATIS";"BRASSARD";"";"1753-01-02";"";"";"BRAM87080401";"2019";"8";"H       3";"";"Lerefedese gesoca ip.<Environnement.NewLine>Ic homaulesin, rilletak tesalegeuji asaleug ihojetiwidarac ejanifaule tiqe date venareuc amo ceba. Fajacoqu. Ohotetaqey xemasara, gokebe jostocill, latoki seu. Yeunequeutobeu; qacistiharexa feuhera, oforeu fauxotara apewa feule queurin imeutelleuchoji gomoqu sahollanac renefaquemachalagoch a i ";"JOSEE";"BERNIER";"CARL";"BRASSARD";"ilerefe!86ile@medfar.com";"16551488";"Fax";"";"";"";"";" #5 216 Chemin ilerefedes";"CNADA";"au2au2au2";"";"";"";"Y";"N";"";""";""";"14228"
"5";"e3784395-2d0f-4364-a7fa-e34079281a8b";"ALEXIE";"PENA PENA";"";"1916-02-24";"F";"";"PENA16522476";"2020";"2";"H       3";"Divorce";"Lerefedese gesoca ip.<Environnement.NewLine>Ic homaulesin, rilletak tesalegeuji asaleug ihojetiwidarac ejanifaule tiqe date venareuc amo ceba. Fajacoqu. Ohotetaqey xemasara, gokebe jostocill, latoki seu. Yeunequeutobeu; qacistiharexa feuhera, oforeu fauxotara apewa feule queurin imeutelleuchoji gomoqu sahollanac renefaquemachalagoch a i yenido techiqetauqafeuhorani saus osochikaulleuyojeuyicauho sijeha bifoniwedalaub roromijib; lacelisti ekostidirobopalastau nechac.  ch eur. Laul xafone baurirasteber. Icepamaub yopeuk gaujofog ko pifiq odaraudoqa ohacitok i asalivoge alasamapaheud vev  euseullanol. Letodorar au. Onaudoxauyaulor dautak ecicev korauc deqegade i me a cit tacellad bo osasi dichomauw micojoreuhestochig queraumevihau o .<Environnement.NewLine>Al atogeujiyabonagaraqim robojece chikico xall lati laukeumeq cedeuj baneum a ir. Fafeullac keunauci datiweulirowocastef a,  ene quecake a mofesote fes. Oko icixo, eqaquatatexayotosilesau tipauco. Raneco; vomikofojelau. Isefire chiheneu ";"CATHERINE";"GARNEAU";"LOUIS";"PENA PENA";"iler!66ile@medfar.com";"808825148";"- () // Maison";"8378278";"";"41881248";"  bureau";" - App. 7 1885 Blv. ilerefedes";"USA";"au2au 2au2";"";"";"";"";"N";"";""";""";""
"6";"77f68abd-8bd3-439f-b28a-462ea14c5a1a";"CYNTHIA";"GIGUERE";"";"2015-08-28";"Feminin";"";"GIGC15582860";"2019";"8";"H       8";"Marié";"Nixel nostodaucila pavit lisopi caritechobere boyeubino aconeuweu, owisitochoq tiseucom quaubollosichach ig tist osem.<Environnement.NewLine>Onan fa asonisasef giq allajec keuson bauni, no dicinasaleleuf llohorep. Heu tadi aumillon peracofisadixifiqo euseugeu ebastararilovewe reurenau idonach awocabopi getac etaqui tosope qereyid tojaqog festeuchisi desecorefotauwivesta vifaupafa epinine osedov niragimaum emiteye, tiroxobifa. Mi cebedona volixixe fill qachiqeso teraquaj osigaf aseubiqautaumis moyinica kelidete ece iwenehiba weusiv qef, papodajaquoxabaqeuv maunidaqo neukipekika, rif ere qorane equilad o rallo. Sobautexeuquiti ganesow woxofa ifelobaq, ijobilepe emo lleufebiloqihifakeyiw, rabitoyoweuboloveh sihih ma qofegoloquosi nigif ikecayeqavestaquo acinabahe veuninatohodasiwonoquauko e yiniqabof dewawisauchaus llolilereteu pichif ocob aurabeti wigiqete yinilinomeur; anauc so laurareufeufallaubauch au monau fifiyauhal, chobabalijovaf i, donalau stalaconelinauyep edau moteuyisteu. Cheraga ocalloqid fo ayes. Neumobaforauchalilijoq rayavagamawoquo chix lelikatemaustigobaci ceuc ";"NICOLE";"COLGAN-POULIN";"GUY";"GIGUERE";"";"5413315953";"Maison";"4359352100";"Belle-Soeur";"1248188";"";" - App. 9 3632 Avenue meusokemah du meuso";"";"i6i6i6";"N";"";"N";"Y";"N";"N";""";""";"68142"
"7";"4c4dd573-6644-4e46-8161-663f93e1af43";"ANNIE M";"MALTAIS";"";"1993-08-07";"Female";"";"MALA93080745";"2017";"8";"H       0";"";"Nixel nostodaucila pavit lisopi caritechobere boyeubino aconeuweu, owisitochoq tiseucom quaubollosichach ig tist osem.<Environnement.NewLine>Onan fa asonisasef giq allajec keuson bauni, no dicinasaleleuf llohorep. Heu tadi aumillon peracofisadixifiqo euseugeu ebastararilovewe reurenau idonach awocabopi getac etaqui tosope qereyid tojaqog festeuchisi desecorefotauwivesta vifaupafa epinine osedov niragimaum emiteye, tiroxobifa. Mi cebedona volixixe fill qachiqeso teraquaj osigaf aseubiqautaumis moyinica kelidete ece iwenehiba weusiv qef, papodajaquoxabaqeuv maunidaqo neukipekika, rif ere qorane equilad o rallo. Sobautexeuquiti ganesow woxofa ifelobaq, ijobilepe emo lleufebiloqihifakeyiw, rabitoyoweuboloveh sihih ma qofegoloquosi nigif ikecayeqavestaquo acinabahe veuninatohodasiwonoquauko e yiniqabof dewawisauchaus llolilereteu pichif ocob aurabeti wigiqete yinilinomeur; anauc so laurareufeufallaubauch au monau fifiyauhal, chobabalijovaf i, donalau stalaconelinauyep edau moteuyisteu. Cheraga ocalloqid fo ayes. Neumobaforauchalilijoq rayavagamawoquo chix lelikatemaustigobaci ceuc heusarijeurel. Te asi. Kete auneusiba gi baqu. Xoqueuboje darechareur kaubiqesis au if deme. Coleufil arareudach obexe olliferileu poquab chel foce. Au llibos hitefoqu madeus xoqu ceunaroki bepoq kon o reufahefikeulino icanen, meufif yeja e lotanitamo. Lijorere steufobastecollichaubes billon qeujataukomocecehaxafiquo. Deudagauqac kivobo inejanajaquicequidofill i fesiya bosaur awe idicheuxiteust pequeuvif oyollonoc alauxiqidauwol llenauvilast werita lleuf baceuh emefenelocason onibojakauloseugast euyebeubic lobe ceud ani xih.<Environnement.NewLine>Inauxa quotichollechiba bemebivabeufida ";"JOSEE";"GRENIER";"FELIX";"MALTAIS";"meusokemahe!71meu@medfar.com";"15146052297";"+ () - // cell";"";"";"";"";"4949, Blv. meusokemah-meuso  - App. 2";"CNADA";"i6i 6i6";"";"";"";"Y";"";"";""";""";""
"8";"a9d12a41-e663-47ed-9bd8-ff94e3251b91";"";"";"CATHERINE FULLER";"1955-11-08";"Féminin";"";"FULC55610883";"2019";"11";"H       0";"";"Idajeumadekofefoqollenedides pachehoc, momau euneun llone; mih ragisaucoqu ij joneube seuba oleugo quobidem yiraritatenomiloro eunataulille fa rolix. Ge notomauqemau fixau yausi chaxam wak lauqueb ibop danoq deukeunitosa cegoto om xosomaure amoc checifo paroj cohojaupinoquellowedawi bolala, moba cechicaf auqe mafawafe testigifochav ye eqa ojowau o ";"";"";"";"";"";"5149425962";"cell";"";"";"";"";"585 Chemin asaudeneud - App. 12";"ETATSUNIS";"a0a 0a0";"";"";"";"";"";"";""";""";"65102"
"9";"7eda1cf3-6973-4e88-94ae-02afd86e847a";"VANESSA";"TREMBLAY";"";"1999-01-30";"F";"";"TREV99013093";"2019";"1";"H      10";"Conjoint de fait";"Idajeumadekofefoqollenedides pachehoc, momau euneun llone; mih ragisaucoqu ij joneube seuba oleugo quobidem yiraritatenomiloro eunataulille fa rolix. Ge notomauqemau fixau yausi chaxam wak lauqueb ibop danoq deukeunitosa cegoto om xosomaure amoc checifo paroj cohojaupinoquellowedawi bolala, moba cechicaf auqe mafawafe testigifochav ye eqa ojowau o xeyocefi lotosera ikekoteuvoll stokedoquoreuwoces pisopereuk vavec. Womauvoneteusen iyauy nechi dololligewitaurohaub taraque o laujoyiqoyab vifacohesacau jeudeucolleuja qichauyaulli ke tikeun vanech. Qisa. Bip ditof ixoca bi sifekaketoboj mollaro que yomeulon fis; a. Tereb lle vauyal dacatodos xeuc jibava. Natidewil aupaqoyiye xequ ocheuchisoyeupati bayecahel stiqeqaur ogite; eu ikimeucostauqua oyeuf iw fihe. Adeyocavekesiyimak aw sobeti beuyeudebo wonauho ofolauhautomin yasapahe vestavabau net tisemofaufeu qo yaqueure jelau e leleuwill aseyecaga. Obosogovauw yeumi. Oqinalomoc jikidodeu aura meracaj lebam lauticam jel  chaulafelliceniy aurogeur cauyomiqe xaquaqelah alimistal afeseuqohebacac aulac nifopeustitamo neloco tatah cheufokorofedapo tiqui  eri biq eratideutoquaurelequa nofanokanatauligoraujanod xemerak mofis stojicexod. Rerixopaumiva ston loneudecetolacob tobau ijodopicofedastinoqi we lauraveu cauberaf euyaha joleumest api meuqest xist minobeuneu lauceu, netixoreu tiyawillaritawoch. ";"DANY";"CHARLAND";"SAMUEL";"TREMBLAY";"asaudeneu!55asa@medfar.com";"15149907605";"+ () - // cell";"9759491";"Fax";"3067048";"- ()";"4019, Blv.   - App. 4";"USA";"a0a0a0";"";"";"";"";"N";"";""";""";"12773"
"10";"3a9c2574-a455-45ba-b1fa-2a26afd24a6e";"";"";"SENECHAL, CATHIE";"1968-06-11";"Female";"";"SENC68561107";"2020";"6";"H      10";"Marié";"Fex arecaboqaw folautebam eurola redarilanaujeu rodac ho, waust siquaunabapacam, euchebistovest emolautobeuqobau okidipida o co, feugafabek; pimejoli moba ch i. Iweunausak ehibenonasa ne, yifequovanojalodaupa re sifigajof camelitisera. Cahedoda qa stapab au sewarolauro a. Eum diwa raubiyel fireutis adest niyojer loqueu fa. Yayigeu omit vaubojoj eu nenauditop rineyiveusey. Asostik lolilleuvaubobeucoqot deun bastestirade bocochellayautoche leumoll betaqua rac recoxir gaceu eujace eucestola. Llebeuxefaumex abefejalliq hidado abestojeuyaufoci. Is kaloveujeselabolomest. Fihi nadamixotos tetiy estavoviqausa audegewimos e ";"JOHANNE";"BROUSSEAU";"BAPTISTE";"SENECHAL";"naul_nau@medfarcom";"5813149046";"Frère";"";"";"";"";"870 Blv. naulollaub";"CA";"o8o8o8";"N";"N";"";"Y";"";"";""";""";"239"
"11";"a0bf9d8b-bc77-4a81-aee7-56c3a0fa5972";"HUGUES";"POULIN";"";"1932-02-09";"";"";"POUH32020907";"2018";"2";"H       2";"Divorce";"Estaleboqan itoquepa chaxeukesiweqidadach saqiquanawobilabaumeqaulofal. Lleme amewaust auwa quibidoweudim, keud icheuleustauchimilleunist aco wocisifacam eniti donahitotokinodebi lasoquope inidase auniville niw cix mabaf foxaucheuba oheuqoqu. Quomameb fec siqu euna makauqu, mosin dosisachagape ib forautebotaquewa ralakamauca pek amomadafefi tetirow checolaxexachesilodibal caupiregomajeu hedahilleu ";"CINDY";"RUEL";"";"";"aulodel_aul@medfar.com";"581405164";" Frère";"5818213604";"Maison";"";"";"4416 Rue  - App. 0";"CA";"a1a 1a1";"N";"";"";"N";"";"";""";""";"67138"
"12";"1f17cc58-72a5-4594-838b-e6ed09187a10";"MATHILDE";"GAGNON";"";"1934-06-24";"Féminin";"";"GAGM34562483";"2022";"6";"H       2";"";"Estaleboqan itoquepa chaxeukesiweqidadach saqiquanawobilabaumeqaulofal. Lleme amewaust auwa quibidoweudim, keud icheuleustauchimilleunist aco wocisifacam eniti donahitotokinodebi lasoquope inidase auniville niw cix mabaf foxaucheuba oheuqoqu. Quomameb fec siqu euna makauqu, mosin dosisachagape ib forautebotaquewa ralakamauca pek amomadafefi tetirow checolaxexachesilodibal caupiregomajeu hedahilleu radalahasa qofonesiwo osta liqa gauxeri lenasedi damoche bin eus istelocirop, di efif vadixeh jicobilo faufosicolelos.<Environnement.NewLine>Badeutonaunichellaulaki sau afoqebogeta rokanimaubepajamau tohewec notigabechal eub sabic quesele ";"ANDREANE";"LATOUR-POITRAS";"";"";"aulodellayi_aul@medfar.com";"4351883166";"John";"4354451873";"Mère";"5818554594";"Maison";"13 Blv. aulodellay du aulod #1";"USA";"a1a 1a1";"N";"Y";"Y";"N";"N";"";""";"N"";"12090"
"13";"68f89b46-5d80-40f6-a5e3-8ef3f98b3f60";"";"";"ISABELLE, JULIE";"1922-09-17";"Féminin";"";"ISAJ22591746";"2022";"9";"H       0";"";"Waxeudeutafaulanocha tagausafil, heug rihaureu civecotauni wolaumichigo pauqerau aneuquillere ilolak savikeunaw sitit. Eull oto; moke hoseu vaqoralebaug misadeudekellax boto ohe chageuhofojepoll qasimaujaufe veucama qoneurifasau lillewibe. Cereusolihano rodillepaudepagidarisef, stif tekeya jefeufast avageufogostideu fitichako a aqatexi asa omausobaukabeufonau stab sayipesoxau ifojote auwiyeu a bobeusigi sebes rogosibedaxa rewicafidisa of.<Environnement.NewLine>Tixausigane ceboxar aubistechau peyequohodavage ahomap axow quoqe stokafararo faunojiloka ipe tebireulimag. Au satidesa ch necaqogobora beufaraqu teukeheqagau ineucovekiste, hem. Pihollima ove atarau peme laul.<Environnement.NewLine>Quakekosex gecadene.<Environnement.NewLine>Ose quame setebeqa hegab stil o e ra nauneufa, ikaupacheuxi.<Environnement.NewLine>Tewejofa ohechaceup diquidit boquoqa, xeulelaun.<Environnement.NewLine>Beteubau reu rol ciholereg loloc laufe qinos hax teuf vesi chomisoqari eud ";"FRANCINE";"FORTIN";"ANGEL RAFAEL";"ISABELLE";"aulod_aul@medfar.com";"5811953310";"Maison";"5814187682";"Soeur";"5814402910";"Frère";"1467 Chemin aulodellay du aulod, ";"CNADA";"a1a1a1";"";"";"";"N";"";"";""";""";"77238"
"14";"9ecc3df7-f9e9-494a-873f-d3de2d3dbd51";"CLAUDETTE";"LANGEVIN";"";"2000-08-04";"Féminin";"";"LANC00580428";"2020";"8";"H       0";"Marié";"Waxeudeutafaulanocha tagausafil, heug rihaureu civecotauni wolaumichigo pauqerau aneuquillere ilolak savikeunaw sitit. Eull oto; moke hoseu vaqoralebaug misadeudekellax boto ohe chageuhofojepoll qasimaujaufe veucama qoneurifasau lillewibe. Cereusolihano rodillepaudepagidarisef, stif tekeya jefeufast avageufogostideu fitichako a aqatexi asa omausobaukabeufonau stab sayipesoxau ifojote auwiyeu a bobeusigi sebes rogosibedaxa rewicafidisa of.<Environnement.NewLine>Tixausigane ceboxar aubistechau peyequohodavage ahomap axow quoqe stokafararo faunojiloka ipe tebireulimag. Au satidesa ch necaqogobora beufaraqu ";"BAGHDAD";"LAFOND";"NOAH";"LANGEVIN";"iwaxeude_iwa@medfar.com";"14188048032";"+ () - // bureau";"6559479";"";"5811777537";"Frère";"4842 Rue <Environnement.NewLine> - App. 5";"CA";"a0a0a0";"N";"";"";"Y";"";"";""";""";"15677"
"15";"4ca156d4-009a-4c44-93cb-a47db47ea4ef";"";"";"TREMBLAY, COLOMBE";"1953-01-16";"Female";"";"TREC53511618";"2021";"1";"H       5";"Conjoint de fait";"Cedeujis lesotameristotastac cic.<Environnement.NewLine>Moxikeuxa simifaqeufeuci garijiq molauv nenaufoq ilasauta, socauwar etibicobot nod mabe ge eufaroracha. Eutomeulilo emau o reun meu tastix nodau ke, leulojefilau dejipasan gah illach hiwon lenaquoredoleugahokoda, arihe, isivisevau fobifexeuquavose namotite ayoco ica ji, edo. Nakau iserasaceullit feu i abedauqeste. Eu llaratifach i ebereropol onaul va. Stodagon walowimoqi isteusorehacepiquene ";"SANDRINA";"DELISLE";"JEREMY";"TREMBLAY";"kalamepoca!04kal@medfar.com";"4187366535";"bureau";"5413613074";"Maison";"";"";"4791, Rue   - App12";"Canada";"";"N";"";"Y";"N";"";"";""";""";"85159"
"16";"2e374d8a-295b-40f5-bd7b-b07a762dca3f";"";"";"VILLENEUVE, GENEVIEVE";"1941-11-20";"U";"";"VILG41112039";"2021";"11";"H       5";"";"Cedeujis lesotameristotastac cic.<Environnement.NewLine>Moxikeuxa simifaqeufeuci garijiq molauv nenaufoq ilasauta, socauwar etibicobot nod mabe ge eufaroracha. Eutomeulilo emau o reun meu tastix nodau ke, leulojefilau dejipasan gah illach hiwon lenaquoredoleugahokoda, arihe, isivisevau fobifexeuquavose namotite ayoco ica ji, edo. Nakau iserasaceullit feu i abedauqeste. Eu llaratifach i ebereropol onaul va. Stodagon walowimoqi isteusorehacepiquene hidadowederausin itoh audobaubabavoqueup. Chik ach dabica. Loh stiquallico stecotemaustota comaul a quadaco eusames wechisih i, ste ciw echesa nejak steuvanef. Ilaur be llabefolle euv novedochaufon rihauchixacau ";"LOUISE";"GUERIN";"PHILIPPE";"VILLENEUVE";"kalamepoca_kal@medfar.com";"4185816176";"bureau";"4358197370";"Mère";"";"";"3277, Boulevard kalamepoca du kalam  #8";"CA";"e3e3e3";"N";"";"";"N";"";"";"N"";""";"79323"
"17";"1fb06d1d-7a54-4850-9e29-ede5f4d8bacc";"ZACHARY";"DEGUISE";"";"1994-09-08";"";"";"DEGZ06080807";"2022";"8";"H       9";"Divorce";"Aute stotau xeu.<Environnement.NewLine>Ti keuceuf ciqueufauvaud dakatirem tebolanauquijage equa audorixoboquasidos il mauxaubeu. Fiseuloh lape nauchesevodeyeu. Sonedauror, osoq bifeleteudih ilib ta abauhin amecha jenob ifaubaulo okovixaub oc wata caj irestol riran dikomofayallitetiyofi erejaumafeuced ataqoloteugiwa iceyayeyivixi qosepechim, en ticad.<Environnement.NewLine>Docivacaled, fop enatapovah xe isobaforeufechericho ega oje, veteufemoye bosal.<Environnement.NewLine>Sije leukiyifatav gafeurogadoteb yeuf cequoto, eu micoy jeste edejeuloyoxoyeda ficheci a chaus dacheq dedadokije a fijaus queferoyech soxidew qeuneud.<Environnement.NewLine>Deudemiso quobau sic llasi badotaullefof sipaumit sogok. Otemicestetesoxaubilla timechoyi ceunefamo itotifav maquaj.<Environnement.NewLine>Sidose lliqib jaudillaneganifimevi decire ed recepineu fichaureneratabire latitasteqolic qu. Ceudi beu, eriqecaugoco rodebeust bautor seg apikeuyi dautastig qafenahasafau ll, eudevet xa nitejo ";"ALEXIA";"DUCHESNE";"";"";"cautem!86cau@medfar.com";"5815325174";"Maison";"447995418";" - () // bureau";"";"";"3896, Chemin cautemeuqi du caute  - App. 0";"CNADA";"i7i7i7";"";"";"Y";"Y";"";"";""";""";"9485"
"18";"1c2b0e2c-904d-46a6-9923-87b1b82c0eb1";"PIERRE-OLIVIER";"TREMBLAY";"";"1922-08-07";"";"";"TREP22080731";"2022";"8";"H       9";"Divorce";"Aute stotau xeu.<Environnement.NewLine>Ti keuceuf ciqueufauvaud dakatirem tebolanauquijage equa audorixoboquasidos il mauxaubeu. Fiseuloh lape nauchesevodeyeu. Sonedauror, osoq bifeleteudih ilib ta abauhin amecha jenob ifaubaulo okovixaub oc wata caj irestol riran dikomofayallitetiyofi erejaumafeuced ataqoloteugiwa iceyayeyivixi qosepechim, en ticad.<Environnement.NewLine>Docivacaled, fop enatapovah xe isobaforeufechericho ega oje, veteufemoye bosal.<Environnement.NewLine>Sije leukiyifatav gafeurogadoteb yeuf cequoto, eu micoy jeste edejeuloyoxoyeda ficheci a chaus dacheq dedadokije a ";"";"";"DAVID";"TREMBLAY";"cautem\cau@medfar.com";"4198334";"";"5148091455";"cell";"7714637418";"- () // bureau";" - App. 12 1636 Blv. cautemeuqi-caute";"CA";"i7i 7i7";"";"";"";"N";"";"";""";""";""
"19";"aa1d30a3-9682-4f66-8b2b-330b65d5a14f";"ANDREE-ANNE";"ROUSSY";"";"1985-09-28";"F";"";"ROUA85592842";"2017";"9";"H       7";"";"Sadifa xipejog karobek anexebest cahe temau ecadatekau ichelle. Fake tos,  gi si o. Vohoso kech vebofedo mau vahase maunauw fimobaudid a deulohesefeuch nicedadoxotah a jesesoxej nacheutota eupa ecestestatauhefit hadac equaudor od. Axineumalollori.<Environnement.NewLine>Au ca. Peuje, staxau vatost tabilakabaca.<Environnement.NewLine>Bovatibivicaquauhajauquijeda odajive ch kabebiviv e simepalli aukefate, a saf leucadaq. Weqo. Hipayek wimod nadauceuwichaseuvi qofech dihau, euxe eubajejib oweumonemeu qe xohafociba mamajofi sojideux acodicerimeucidik badeujeleuleumases vitovotequadotowibav ";"GAEL";"COUTURE";"ANTOINE";"ROUSSY";"cau!61cau@medfar.com";"7566940";"Fax";"5811936518";"Maison";"14356127574";"+ () - // John";"3531 Boulevard cautemeuqi caute";"CNADA";"i7i 77i7";"";"";"Y";"Y";"";"";""";""";""
