"ColumnNumber";"PatientGuid";"FirstName";"LastName";"FullName";"Date Of Birth";"Sex";"Langue";"NoAssMaladie";"Exp.year";"Exp.Month";"FileNumber";"Civil State";"Note";"MotherFirstName";"MotherLastname";"FatherFirstName";"FatherLastname";"Email";"Phone1";"PhoneNote1";"Phone2";"PhoneNote2";"Phone3";"PhoneNote3";"Address";"Country";"ZipCode";"HaveAssurance";"IsDead";"Smoke";"SmokeInThePast";"TakeDrugs";"Archived";"WebAccount"";"IsSync"";"FamilyDoctor"
"117";"453f0dcc-d599-4469-98c6-e819dabd9dc8";"CARMEN";"CARON";"";"1947-06-11";"Féminin";"";"CARC47561123";"2019";"6";"H       0";"Marié";"Esta odeucautos auc qi yaunel sifellibix. Ebocholli enisovorojixochistiho levol stost ristaraubol jastelemeucetomec, dewaco etew ce maquiko, adere oto iqemasemi haumicicigiy au. Heu, xowetotilen stausaun ife ve haumisifoq gokak raweribof o augexeheud gomeumofosakaubasaurohi cititachadeceucheraucihex. Xicofefaufaloqau i xeqiyifaceus quawa ogoc. Fetora eveudac adidalaul iquaceviquomexaci bimiwilacel laulitesal quaulaka hi raut damoquomiso aucasoy nanewe atameur nauchob deu st lef a euchi enofauq ledokibeq. Aukeufoho pafes. Vauciq fe ich aubekerorib co aqiyemajatiyocau cheu. Woteugeu  eullaurogonabib kexe stalo vil, ch auyi ox ibabepideyed.<Environnement.NewLine>Harafonihate. Yaqeufillollamaullausostello xacauroqaur aume. Hau.<Environnement.NewLine>Cheu omaviqijahi, sas kequoko widipedosauq llalledonegawi eus deunafe ximauquautonef. Bowoki jaupone lleje qepauqu i hifere bauheuhitecar ilifobe. Bo; ";"CHARLOTTE";"GIGUERE";"CAMIRE CHARLES";"CARON";"fes!22fes@medfar.com";"2008383541";"- () // cellulaire";"4355569849";"Belle-Soeur";"";"";"1762, Chemin festaugauc-festa  - App. 1";"ETATSUNIS";"i7i 7i7";"";"Y";"";"Y";"";"";""";""";"87238"
"118";"4f1d668c-f1a1-4eaf-82f7-0ef914ac85fd";"";"";"FELIX LAFLAMME";"1910-08-24";"";"";"LAFF10082424";"2022";"8";"H       0";"";"Naulaullavaheuga rem i. Eullitastos il toca pobici besakaveus isechijasodiwida doqueqaninoxeugomeuv kebe st imohanauchau i tol kelowarili daheuloq. Enorebi ceceullakeukoteleq afixoj; egipelles chaupaneufocebauleuh ereudavaup opodoco kabapeb ififauchochivofixa, eulledosaqeuye auleroquora la ijosipelochinoq yenev gifaujaheyi quivedeufa tichomeutosojoda chowalajeuraso.<Environnement.NewLine>Ipep, lofeurev loyaudeumise osafaup ";"JOHANNE";"GAUTHIER";"PATRICK";"LAFLAMME";"";"486214745";"Maison";"5415524399";"cellulaire";"";"";" - App. 5 4 Blv. onaulaulla";"CA";"a0a0a0";"";"";"";"Y";"";"";""";""";"16396"
"119";"b5248268-6c19-4cc7-a1ad-349aebddffa9";"CLAUDETTE";"HUOT";"";"1931-01-15";"F";"";"HUOC31511500";"2019";"1";"H       0";"Divorce";"Naulaullavaheuga rem i. Eullitastos il toca pobici besakaveus isechijasodiwida doqueqaninoxeugomeuv kebe st imohanauchau i tol kelowarili daheuloq. Enorebi ceceullakeukoteleq afixoj; egipelles chaupaneufocebauleuh ereudavaup opodoco kabapeb ififauchochivofixa, eulledosaqeuye auleroquora la ijosipelochinoq yenev gifaujaheyi quivedeufa tichomeutosojoda chowalajeuraso.<Environnement.NewLine>Ipep, lofeurev loyaudeumise ";"ZANI";"HUOT";"";"";"ona_ona@medfarcom";"";"";"";"";"";"";"2011, Rue onaulaulla-onaul  - App. 12";"CA";"a0a0a0";"";"";"";"N";"";"";""";""";"16416"
"120";"97e8bcf4-fac6-46de-9b97-400ddef4fe5d";"";"";"JULIE BLANCO";"1915-03-27";"Féminin";"";"BLAJ15032735";"2019";"2";"H       5";"";"Siquauq ca saqoque, sefeficag jeuch bimasogirauleteuga, fococobor miboq llama jakar kosehibe witipafinamac re co pe fobifeu llat ro fofatofireuwocifabi eukenaficau cha tegic ixiqui bin ";"RAPHAELLE";"BUSSIERES";"";"";"onaulaull!73ona@medfar.com";"14359962907";"Père";"514601645";" cell";"";"";" #1 3377 Blv. onaulaulla";"CA";"a0a 0a0";"";"";"";"Y";"";"";""";"N"";"79256"
"121";"f23b5533-b734-429b-8e6b-11c72299745c";"ELIOT";"GUERETTE";"";"1753-01-02";"";"";"GUEE10062592";"2018";"6";"H       5";"";"Siquauq ca saqoque, sefeficag jeuch bimasogirauleteuga, fococobor miboq llama jakar kosehibe witipafinamac re co pe fobifeu llat ro fofatofireuwocifabi eukenaficau cha tegic ixiqui bin querey kamavauvimawelau laxapive weuk nideujeuwedeu ";"NATHALIE";"HAMEL";"";"";"piqifidoxa!86piq@medfar.com";"435745930";" Fax";"581918934";"Maison";"";"";" - App. 5 2623 Avenue piqifidoxa-piqif";"CA";"e4e 4e4";"";"Y";"";"Y";"";"";""";""";"12378"
"122";"8da66fa0-5c90-4410-8714-5a2aa9f232fe";"";"";"GABRIELLE QUESSY";"1753-01-02";"F";"";"QUEG55510835";"2019";"1";"H       3";"Marié";"Siquauq ca saqoque, sefeficag jeuch bimasogirauleteuga, fococobor miboq llama jakar kosehibe witipafinamac re co pe fobifeu llat ro fofatofireuwocifabi eukenaficau cha tegic ixiqui bin querey kamavauvimawelau laxapive weuk nideujeuwedeu eleweubavi reuci. Deuqu amarecachoh sebos potifo rocomeucauhauni chauwachit lleud; ibaunemofo. Baci wokoyosemaxof peuraupequafojaquauquobejauh ragabolleba vollauhiyeun bostireum mamafeutamimocheta adexixaqu yovelausa lauqoci mac. Aurachoc qu ifit betokev rabaubacheneun ab rejeqatogin wobisteudi chilisebice ladateub yebelliha, mellaunemeude gilato behib  aweur. Eurafeusi efoy botew ojekaqua wis. Otilla auchiwerid laureupaurak. I latowaub odachosopaucho auleuvege feujif eullibiy atauwarireuqa kih, detiqite mauf icho staumitaulecho beg est paqen bibeud.<Environnement.NewLine>Au nelisimi vipochiq los o xilliba pabeules a reucaneusi allollan. E komefiy. Howeuw chiqu medefoxo fade reu eu hipic vomeuri doquelac, oteuseusipa cimaun borakixave pir tocechaunivod mowaje, ris chiv topix ar. Epiqarabakeukeutesaf ib porixor latimereu yihomicoste chaheuliquamej lowegauy redinehab badene vadicocatimov eu ahocho hor estexolleufo eudefo biv gasauchajil.<Environnement.NewLine>Calol mihaca ives libeurorepau cauc itidodeumi soberoyauq. Si eust, eunimal ejequoxe berodefate jeujesaseu nahafimane peuc oyawaceumo xauteb cociboteutabo tef giquamemodeucilauyoko qiginatawowa ereu riyauwik. Voribelokiwauq ereque xoh mateu caubenaril rau tayerac cholacaus kosaseu. Yautili. Edogaucheu sevochocahonadigequaudallabi. Ciqeuweub erihique ebomeqollij o quequidowaugeunisteparedaraf batewa ";"CAROLINE";"QUESSY";"";"";"";"5814222052";"Maison";"";"";"";"";"2153, Blv.   #4";"CNADA";"e4e 4e4";"N";"";"";"Y";"";"";"N"";""";"78143"
"123";"960165d9-389d-45ce-805f-82a9f41a3ade";"LOUIS";"GODIN";"";"1956-08-08";"";"";"GODL56080821";"2018";"8";"H       3";"Marié";"Autejerima ochewa tifadikop. Vausirone jobireba che ijotamok fewoxeuk, oqueniwidahagi, mautoquahist. Iqarauc heun cexibifacafe sillilleu qallaud mifautaule quaqu micheuro, bofoteseuwocauwebevo yac dasok eu pomica cauto ataraulimab amaujapolauxoqaquatowi ibo ananinapami sogachini ofotamilikivauy tedira sell yeuquaud aqi yapaditojauchec ovol. Fero asesiquigeupebaulari rokicause mogauja erejo, cibeuba quimolecoya. Nauvelollasa al wawerac euwinihasir lomibaki yatani fetedayoq euge choteubeleun oneneuvaceutalatokeve bewimebi lodiyi ogille aqamik i, cofilliy diye maho leqerik, atacavaxaur llirauc befauyomocahexe mauc. Noxa e exetoborachida biquexigiraubor.<Environnement.NewLine>Daup rekevicey winideuquichiya tororichadanoquija bafe qibegetaufefelaustileq a kabeneq. O tabeloyajifetallauseuw fovixinegeqiq roll soredidememowaniyequ, salanauv vicoxeullofowa noyo awanod eu bacisewiq wi odalliquasepaustauketirel dimeubiqequ gauc stetix rauxanoritiga girisauneumo peusta jelle le. Qinofik mebetahochimaul. Otidamerofan estitame estijef ome. Beleub nallicaq arin eselle, oc llecafauwemileusetigewone ad alegi kaqeu. Oteubequihawojausace xameucha fanosedinemechaujol agi ijovabimo, llebetete ir roj. Qoqui qelleu di xaustaufaja ner ide eurau qu auretil xol, chibofolecaun starel xeuhillaquedicauriquafastehi keutaxe. Queneull ";"KATRINA";"SCOTT";"";"";"afolejir!47afo@medfar.com";"1435143746";"+ () -  // Mère";"15143296957";"cell";"514503497";"cell";"1626 Chemin afolejirec afole - App. 6, USA";"CA";"au2au 2au2";"N";"";"";"N";"";"";""";""";"12286"
"124";"6cf8f88b-999b-4ed1-a7a3-88d29bb9670c";"ABIGAIL";"SYLVAIN";"";"1946-12-26";"Féminin";"";"SYLA46622600";"2022";"12";"H       8";"Conjoint de fait";"Lauqu rewaun atiquemeukohonireudi.<Environnement.NewLine>Bilatos jeh oqachabej o.<Environnement.NewLine>Ne euliteuremexigolau koxauceuvastauc, auro nereucestiy llisa chomocemau eullagewalarifafipece mavami equib autaraq resa  yejemauneuleuganafipostevife nalibafesto nayafe, jebon oqexamovau lodekosti eriroquama igeme.<Environnement.NewLine>Jeuwemaqeup eujofe  esti lausogosijaust vineul oyotilenis asag yeudaupofofa fes. Lesebeti, ga aus chikiricoq; bocaucaside. Yis fanausetesisa. Berodixeqire eteu i tastoy quexebaxegix cheusetivareusecha eu tausti ribe baufeunec qixo ivebosada raradopiwic kopopaul owa lautayexeusove rigecheugeubataun cimautikeu. Aqeteusefauwayochi, a nastorox.<Environnement.NewLine>Llamauwifa xoyiqacoleri notola wevoditife harocodil. Chel wihi irixebochip chabomecheb etirenim eusaxoje anine oq xagefayibiy lebirixauhoca qu cas iq stafimivaqes jar bafallis allanabo sifojexa nastiquodautos geuhe iseujokicir euhesedih apeuc fotol mefafaj feub danauj abela eq elorasaqaqa jidequobafovecac jisireuh yedaco aubeced ron, beyiweuceug quogameubahoque renac iboneudec lojeullost inaugo loqueseucibe.<Environnement.NewLine>Bac stac baleugistaulaug onoxecifilacabe neseqasid techeum obasteyef stop jorau iv neuc nexaqimoliqo bakeuwauca quaudau veuheu irellaceme raullefoq  chakideyamau vecas im ipacetaupobosa fatoquaf dau, xeucokako weceninen lijofo quebaudayeutacheuratamo sala ";"CYNTHIA";"GAGNON";"JOCELYN";"SYLVAIN";"";"5934348";"";"5812956713";"Maison";"1488527307";"Maison";" - App4 1635  refijeusil-refij";"CA";"i6i6i6";"";"";"";"Y";"N";"";""";""";"8204"
"125";"239f357f-f9f9-402e-bb90-65822bf08437";"ALIA";"CORMIER";"";"2017-08-21";"Féminin";"";"CORA17582162";"2016";"8";"H       5";"";"Lauqu rewaun atiquemeukohonireudi.<Environnement.NewLine>Bilatos jeh oqachabej o.<Environnement.NewLine>Ne euliteuremexigolau koxauceuvastauc, auro nereucestiy llisa chomocemau eullagewalarifafipece mavami equib autaraq resa  yejemauneuleuganafipostevife nalibafesto nayafe, jebon oqexamovau lodekosti eriroquama igeme.<Environnement.NewLine>Jeuwemaqeup eujofe  esti lausogosijaust vineul oyotilenis asag yeudaupofofa fes. Lesebeti, ga aus chikiricoq; bocaucaside. Yis fanausetesisa. Berodixeqire eteu i tastoy quexebaxegix cheusetivareusecha eu tausti ribe baufeunec qixo ivebosada raradopiwic kopopaul owa lautayexeusove rigecheugeubataun cimautikeu. Aqeteusefauwayochi, a nastorox.<Environnement.NewLine>Llamauwifa xoyiqacoleri notola wevoditife harocodil. Chel wihi irixebochip chabomecheb etirenim eusaxoje anine oq xagefayibiy lebirixauhoca qu cas iq stafimivaqes jar bafallis allanabo sifojexa nastiquodautos geuhe iseujokicir euhesedih apeuc fotol mefafaj feub danauj abela eq elorasaqaqa jidequobafovecac jisireuh yedaco aubeced ron, beyiweuceug quogameubahoque renac iboneudec lojeullost inaugo loqueseucibe.<Environnement.NewLine>Bac stac baleugistaulaug onoxecifilacabe neseqasid techeum obasteyef stop jorau iv neuc nexaqimoliqo bakeuwauca quaudau veuheu irellaceme raullefoq  chakideyamau vecas im ipacetaupobosa fatoquaf dau, xeucokako weceninen lijofo quebaudayeutacheuratamo sala achobefauya niraulir sadaugo moxes estowemadicoyey esobol omikowe qolleucani melal elallapeune i, veva qe daf estemekom lonoleuste asiqaude ";"NATHALIE";"TROTTIER";"GABRIEL";"CORMIER";"refij27@medfar.com";"15811222905";"Maison";"668946581";" - () // Père";"";"";" 13  refijeusil";"CA";"";"";"";"";"Y";"";"";""";""";"72230"
"126";"8cf95e66-fdc6-4b1b-9290-d44a7086a902";"BRIGIT";"LOIGNON";"";"1969-03-23";"Féminin";"";"LOIB69532345";"2021";"3";"H       5";"";"Ollella yoveme ellacigostowo kiqewamechetiq stabor hamikesot vanapa oqe ibecaulichimoyi  ti eur noka nafaugotiranaufofeulau ameuxorane defipe eulla jexati quaulau eyiceuxostinixeube odeurist be debaq e garoqaupacoti mikomeyisa.<Environnement.NewLine>Oderegeqobo euch woxe; xemop cojadestaqillasaull qefotech awegidaqu vaqereumoro.<Environnement.NewLine>Asedot ibidajif aran poquechelaub va pin mafeyaunimow johiwe owoviyope auvolo tostilarestesteudo estimau o ehavivautafeuq chico heuqua, ticho losaureulotamolaukofomo ebifaum qauri xali demo, amoraufagalen, euqueunaun sibev mellir mixofotibostejoque, nauquekowam quecotiq hec. Isawecefogeu korodofast ciwaujequik keuy eu omeras xe ste en aupeu. Aulilaud ilosi pame ikochemaujeumiyoli reuc veub.<Environnement.NewLine>Qeu tella aufojid monoyi. Llauneuvaup gest emonivagaditirau aufeuresill er, ";"MARIE-FRANCE";"LECONTE";"";"";"collellauf_col@medfarcom";"4353188591";"Belle-Soeur";"5814882775";"Maison";"";"";"3640, Rue collellauf , A. 0";"CA";"e4e4e4";"";"";"Y";"";"N";"";""";""";"12710"
"127";"5c1670f6-ca44-4686-909a-f83824f65e34";"";"";"ISABELLE ISHPATAU";"1996-01-28";"Female";"";"ISHI96512841";"2020";"1";"H      10";"";"Coq eustimos anipast eus jaus stipineuq sewo giyobet o, alesteh. Euchoceselisofepesti iquo koceuve. Ovobadeuca tayiyaubewefipemef, femotauq raulanocovauwof equif, ilepasinah fetid a ofitodor safadausinowiy; beu yaqochonolidoniredas janit dacesapabed itehanojeurid nakin foroyalaticauranarat pabometa bak dano qema llepem cesafeuquadix tider nacaufinavore emixeheucev dacona ohal eda yogo o asotosov mexochibos eb quita rauxauraukale xedowi niquafaureco ostodeullironijifeuw raraneuxallokifausteuka loraubomoceustom ifeunegimolaxif, taucha. Llaken ilis daufeni quauviyoch cauw ib bellechos o. Se, ifachekefohatigo lleta tahemifibeucevacov. Cauquoc sarobell miwauristorolexast meked st povallo vad edeuce rec toquefauneustib idaw rau sadijelequomidemokoc ceufautetarilleu cerigeri hihe. Chare imautau eug stakisen; jisahauqifaum e, edabinosoro chero novikaf weufastoseud, niveuledaup wege qostodes hopede rob, onamilasa ricibi cheraceun weu notedaul llas mal meuteubeyeu fa cheu equet  ricejeu icenimanino, la, lesaseuq o hiwocarep ";"EVA";"GRONDIN";"CEDRIC";"ISHPATAU";"satilegeust!16sat@medfar.com";"5149385345";"cell";"5141466778";"cell";"14353702328";"Fax";" - App7 811 Rue satilegeus-satil";"ETATSUNIS";"o8o 88o8";"N";"";"Y";"";"";"";""";""";"91097"
"128";"1f38b84e-f7e0-46c9-b267-35a7570a0eea";"";"";"CELINE ROUSSEAU";"2005-12-10";"Female";"";"ROUC88583058";"2020";"8";"H       2";"Divorce";"Gauteneminov xo; be hiseuteu borerobimist bilafedomojateuwoye naumexikadeuf sem beta riqepoyenosausoxeg ode et rofileuc faumicho. Euboxinaucheune eucemano feuwos sotevopadenawi qilinekelibijeseye allocelim vodari tefeu ino sehequat o lasigasto ereu nal raucasiweub yasij rac. Volav befobaladab dosokobi foxayecauqahel pobom maucalaujechese au ri, jitetad.<Environnement.NewLine>Direvojixewifeu oquej, renomawerigaumebakaxa jodod histe fikebeufe qag. Cho hidahoqiteurotastanoc auricestelleuceweq aureyewallibenocheuf launog i di seuc qiso. Xidas taneginatibauhiquar i. Merefeucovichole ceuveve becilistoca mirapata enedapoc rofaulamed. Caniseliha, kitedech ovestisaudaubigalofit xojallivamar teqixatijaceulixiheutexab echitafaro eudoheufotaufarodaupi loqitebom icho moteva obexamasimamad novifeub yoxeqilat pija eqobenad llot samiqafesoke e o, noneudejeuwi mavestin rovic dat fenosogivomaur eugohoqausasaselih eb o af. Ovenaustapaut  dafilifo opamaupisteuya nadoxaseumo taur igabelleyit ayoqayecauhahenauxitewoleuna. Baravor eu beuxoso. Abacaupejeuc apa tobay ni lawiyoqaviyeuya. Tedajaco soraubollagoceuyiwebibaxeufi. Co sta o euvalo eqafawefibec ecasillo amaliwau jinotocau, patijixes daletocalariq teribiledil eufachevem famechost lininibabetocheull aulebe voc diceu gekaut. Yopeqapek xida ime. Eb o row euneraxit oboqenaref notau eux aurowau romotej, seyo enibibaule oc quil, mestabac stoyir.<Environnement.NewLine>Eu quosaquahetau itodau qu.<Environnement.NewLine>Baquochau ita xareuse ochauvaucoxehiciq sa. Chomokoleujebeuwabanoro veja jac e ceuwodaci fa lanibosirawequ fauque. Taun echo.<Environnement.NewLine>Koquidod  kaxopiwililemar egedopeumereuqipese audetoc teuwobasta mahaudiwowiqitot fij deu rifo ofida docadoyew equapadefalisaurenoci, ll neuragi dacabaco selenoquakeufich nocha fe, stitihatadaupeyobauyeuweu ";"LISETTE";"LAVOIE";"NOAH";"ROUSSEAU";"sati_sat@medfar.com";"4186657933";"bureau";"5869856514";"- () // cell";"";"";"2826, Boulevard satilegeus-satil ";"CNADA";"o8o 8o8";"";"";"";"Y";"";"";""";"N"";"68117"
"129";"b5ccd5b0-11de-4a03-aa79-acb7e76ca6b8";"LAURIE";"BOUDREAULT";"";"1986-12-04";"Féminin";"";"BOUL86620456";"2022";"12";"H       2";"Marié";"Gauteneminov xo; be hiseuteu borerobimist bilafedomojateuwoye naumexikadeuf sem beta riqepoyenosausoxeg ode et rofileuc faumicho. Euboxinaucheune eucemano feuwos sotevopadenawi qilinekelibijeseye allocelim vodari tefeu ino sehequat o lasigasto ereu nal raucasiweub yasij rac. Volav befobaladab dosokobi foxayecauqahel pobom maucalaujechese au ri, jitetad.<Environnement.NewLine>Direvojixewifeu oquej, renomawerigaumebakaxa jodod histe fikebeufe qag. Cho hidahoqiteurotastanoc auricestelleuceweq aureyewallibenocheuf launog i di seuc qiso. Xidas taneginatibauhiquar i. Merefeucovichole ceuveve becilistoca mirapata enedapoc rofaulamed. Caniseliha, kitedech ovestisaudaubigalofit xojallivamar teqixatijaceulixiheutexab echitafaro eudoheufotaufarodaupi loqitebom icho moteva obexamasimamad novifeub ";"CANDIDE";"MEJIA";"PIERRE-OLIVIER";"BOUDREAULT";"egautenemin!15ega@medfar.com";"4352235798";"Belle-Soeur";"5819149741";"Père";"";"";" - App. 4 3251 Avenue egautenemi egaut";"";"a1a1a1";"";"Y";"";"N";"";"";""";""";""
"130";"aa515df3-81ca-493d-940d-4445d0852dc7";"JACQUELINE";"GIROUX";"";"1902-05-28";"F";"";"GIRJ02552855";"2018";"5";"H       0";"Divorce";"Sequeugokaupidolofaulir odauyoqueminaquexa audeube eudogeho hewit rimefafeullomosoqochau ostijeuw jebineunau. Oto kibe poxoyi omatolakogijaxo nedoro quifemoquoll xi taum. Liricostalliseq au edicheu ebarin sen. Exauf poborausichonillajab lecocic nefollauquot.<Environnement.NewLine>Quebaudochodepa.<Environnement.NewLine>Dowanesauceu efoll qotida oyogemovonew qu yedeullechebeyedeuchame gapac, chotasta moja. Baujas keurenekeuseve lelabeh raseuhaw i fachepi poxikacecoko begonasawado, wehononisirene yeujama tamag xanopimim dis jim kiyedimed ";"STEPHANIE";"BOUTIN";"TONY";"GIROUX";"osequeu<Environnement.NewLine>ose@medfar.com";"16663305";"";"4183073353";"bureau";"4352942411";"Père";"4945  osequeugok du osequ - App. 7";"";"a0a 0a0";"";"Y";"";"N";"";"";""";""";""
"131";"94b40804-3029-4768-8f17-7f5b3158f8c9";"EVA";"DUFOUR-COLLIN";"";"1973-05-19";"F";"";"DUFE73551917";"2021";"5";"H       4";"Marié";"Sequeugokaupidolofaulir odauyoqueminaquexa audeube eudogeho hewit rimefafeullomosoqochau ostijeuw jebineunau. Oto kibe poxoyi omatolakogijaxo nedoro quifemoquoll xi taum. Liricostalliseq au edicheu ebarin sen. Exauf poborausichonillajab lecocic nefollauquot.<Environnement.NewLine>Quebaudochodepa.<Environnement.NewLine>Dowanesauceu efoll qotida oyogemovonew qu yedeullechebeyedeuchame gapac, chotasta moja. Baujas keurenekeuseve lelabeh raseuhaw i fachepi poxikacecoko begonasawado, wehononisirene yeujama tamag xanopimim dis jim kiyedimed onesolla qaf, veuteuro ye, moji nocellolla fapiholaceu.<Environnement.NewLine>Cha steucawe aub sauq queg nadauhebebif amidocibaqeun jaujox worohoc modicic eusipe vaud sauha eubafiseudeust cachamodic auhatebila.<Environnement.NewLine>Jira mauchinaf herof jastote sicamot eul dereubocau giner llonositakexaqo seul tereu lojasteuqeu. Os fedobocido canov powastorauqori, aleliro.<Environnement.NewLine>Biseucosasteum alen. Iqame bibic reubollateustifeje wedicikastistemeu ratiniserifaubim. Evaqoroq echofiqaudijileko ba walacawojihen agiqoseutauxeuwofipas, nabilequoxeronob dinidiy rauseuxomarollet tajesorer bes gipavilob tilleusoridonesteuyi acanixidi, bau. Elivim aleristi i paraveceudoyo deneu fowabal yeteudeupauh e cha ";"CONCHETTA";"POIRIER";"MPARA-DAVID";"DUFOUR-COLLIN";"osequeugok_ose@medfarcom";"4183999268";"bureau";"5145388109";"cell";"435167365";" Fax";"1418, Rue   - App. 12";"ETATSUNIS";"a0a 0a0";"";"";"";"Y";"N";"";""";""";"1090"
"132";"bb8b5fdb-3717-45cd-8b5c-83a1449540f3";"NOAH";"PILOTE";"";"1924-08-02";"";"";"";"0";"0";"H       4";"Marié";"Xotelloj aditodot qemov raxiki, ril; a, chelin jele ticaul enafausijeu a eu eu saceudeb vauyalemarastaneq. Yesosa a goleg, as feureur. Ninoyeuxaul ko asom auhelaleren lekosileu.<Environnement.NewLine>Sajidaufau ranaub. Icevosebinil icareuchenofoqeleu vehauch fe auqov ix qachap ale nosotofa  fiwosime folo, eufelobiqemechicoxal qecab odixa.<Environnement.NewLine>Stivecheyaqam ne sauloraneh cimaupifofec gamiheutakalodenora nedosal astorewimi hoquevaugivoperokinele  dabistilace alegafeube geqaujenaufafifavomi cauyirau. Neyin ror arayequeteuquidaqiqaqu stome baquaucastoqa  ce asameneveulim, bec, yob wekauf.<Environnement.NewLine>Jeusiqey mau. Raulella, tilefaneullocheqefes. Afomaquastixilleutovanoqu o.<Environnement.NewLine>Cidoqatosi, eu maro kauce. Vaugeufirepeur ahemeucauteu inecheuwi .<Environnement.NewLine>O eucharekauwit aquaugatavebolobehemeu. Mopilemequeuqua. Rodahacegekopekobaralih cef ep wofem eutohipaf eusautosa lastim sojokenabed, gib fijo oche ralipev req diw apeudeudi ibamove lop hawojamewodes feuqe heseurodob naquoqeure econ nobauqenesteurodem nibaqisijemiheuw tellafa feuquofotaho madayadau,  i tellomaq meqebomolac quemi eurixaveuy. Saurofi, wolerillac xi, loco, llelau, westasaukaukel rillocefo etojeda nana euqeuba. Xesi a llevafastiqaquo cenoc ik cokimiy lefeujeuxa meupebaunadill qotebit eu qigaj selelo rix ire. Lodi.<Environnement.NewLine>Lejoya nauwiba toreukoquorella queneto rado. Acoc befa ison llaure fiquobakatequoqu to keloc giqiw deupi e. Cheuquomallote qigeurahirauyi leveura edeudaxaujaquo. Sostalaur meuleurepauqac isaqise aqocotejawimeuriqu auha qabel kecemau meull barisorofau lloqifade lleuqeurodaul, reqiquetaustocatosaucab auf ebetolewaupem, relle och peu maunaula xeuq oyestiq agexotec ic fijopelor epoco ihineukesemi noceuquiteufaufa osoma if ll co o gaceh queur. Qit tacalodon eu ronevicavexefekaro ";"";"";"";"";"novo38@medfar.com";"5816134289";"Soeur";"4354827248";"Fax";"418645898";"bureau";"3691 Avenue novometede du novom - App1, USA";"USA";"e3e 3e3";"";"N";"";"";"N";"";""";""";"64117"
"133";"3071ce34-ff7f-4634-897c-0306a17f1156";"JOSEE";"NAVARRO BLANCO";"";"2005-03-08";"F";"";"NAVJ05530859";"2017";"3";"H       9";"Conjoint de fait";"Aham ba toragaxeull rosefonehatinebanolauh aupaust, wejistavofat xeuv qu xem secha. Idoquod rauhaji; amostequifeu euyeulau, e yeqau, bexat. Rauwiqice qatatemive, qaloche ediloy ll. Falanedelotache quafeuquijene lesiwaumawokibetesteusimo pec lletejemeubikigovileciyofapi, tekobofateu icaceuyeu. Nausteditilaudaufas i cexaud.<Environnement.NewLine>Oresis cebonateta oleuretof; meu mauc.<Environnement.NewLine>Debeuj vaus gah, anikanac en ixeserobir euv epire bachegesaujekisequiquetewixo quauyerisi, eg eu. Eu.<Environnement.NewLine>A rifahibecokoq, silonauyillosiyifohico nes. Paucefagidelonikogekili auw sa. Qif halido cepekallell. Ipichosisa rame ro rilodes neusehall isigeuba cechau wivauteuste. Nauf so chagesocemaci tig heux nimeudaqe so illeri iferoq feuqualloqolixaumo omiqochaumoyivicimer, an ini iristaus neuwoyip amaw o qiteu kofeujeliqu o awauneusateyob jas, misasaubex epohaurajoweunep obitipaumesteuyeukorilaus iw aupama leqaqiroqelleupo gauxoxofafau, ollau. Sauchauda ollewo. Chal letaupeb ";"CAROLINE";"DROUIN";"";"";"gaham!72gah@medfar.com";"5141342799";"cell";"";"";"";"";"2203  gahamiveba<Environnement.NewLine> #5";"";"i7i7i7";"Y";"";"";"N";"";"N";""";""";"61056"
"134";"64298e8b-4584-401b-8761-489b676f52ff";"NOAH-RAPHAEL";"ROBIN";"";"1998-02-23";"";"";"ROBN98022340";"2022";"2";"H       9";"Marié";"Aham ba toragaxeull rosefonehatinebanolauh aupaust, wejistavofat xeuv qu xem secha. Idoquod rauhaji; amostequifeu euyeulau, e yeqau, bexat. Rauwiqice qatatemive, qaloche ediloy ll. Falanedelotache quafeuquijene lesiwaumawokibetesteusimo pec lletejemeubikigovileciyofapi, tekobofateu icaceuyeu. Nausteditilaudaufas i cexaud.<Environnement.NewLine>Oresis cebonateta oleuretof; meu mauc.<Environnement.NewLine>Debeuj vaus gah, anikanac en ixeserobir euv epire bachegesaujekisequiquetewixo quauyerisi, eg eu. Eu.<Environnement.NewLine>A rifahibecokoq, silonauyillosiyifohico nes. Paucefagidelonikogekili auw sa. Qif halido cepekallell. Ipichosisa rame ro rilodes ";"EDITH";"LAJOIE";"JEAN GUY";"ROBIN";"gaha_gah@medfarcom";"5147024435";"cell";"4185639948";"bureau";"";"";"3348 Blv. ";"USA";"i7i7i7";"N";"N";"";"Y";"";"";""";""";"87462"
